tickerID,IQ_BUS_SEG_PRIMARY_PIC_ABS,IQ_BUS_SEG_SECONDARY_PIC_ABS,IQ_BUS_SEG_PRIMARY_SIC_ABS,IQ_BUS_SEG_SECONDARY_SIC_ABS,IQ_INDUSTRY_SECTOR,IQ_INDUSTRY_GROUP,IQ_INDUSTRY,IQ_PRIMARY_INDUSTRY,IQ_PRIMARY_INDUSTRY_SUBSECTOR5_ID,IQ_PRIMARY_INDUSTRY_SUBSECTOR5_NAME,IQ_PRIMARY_INDUSTRY_SUBSECTOR6_ID,IQ_PRIMARY_SIC_CODE,IQ_PRIMARY_SIC_INDUSTRY,IQ_COMPANY_TYPE,IQ_PICS_CODE,IQ_BUS_SEG_NAIC_ABS
NYSE:IRM,Data Processing & Outsourced Services ,IT Consulting & Other Services ,Data processing and preparation (7374),Computer related services (7379),Real Estate,Real Estate,Equity Real Estate Investment Trusts (REITs),Specialized REITs,0,0,(Invalid Subsector ID),6798,Real estate investment trusts,Public Company,60101080,"Data Processing, Hosting, and Related Services (518210)"
NasdaqGS:VRSN,Internet Software & Services ,Data Processing & Outsourced Services ,Information retrieval services (7375),Data processing and preparation (7374),Information Technology,Software and Services,Internet Software and Services,Internet Software and Services,8021200,Online Services,(Invalid Subsector ID),7370,"Computer programming, data processing, and other computer related services",Public Company,45101010,"Data Processing, Hosting, and Related Services (518)"
NasdaqGS:CDW,Technology Distributors ,Technology Distributors ,"Computers, peripherals and software (5045)","Computers, peripherals and software (5045)",Information Technology,Technology Hardware and Equipment,"Electronic Equipment, Instruments and Components",Technology Distributors,8133200,Commercial Electronics Distribution,(Invalid Subsector ID),5045,"Computers, peripherals and software",Public Company,45203030,Computer and Computer Peripheral Equipment and Software Merchant Wholesalers (423430)
NasdaqGS:TRMB,Communications Equipment ,Systems Software ,Radio and Television communications equipment (3663),Prepackaged software (7372),Information Technology,Technology Hardware and Equipment,"Electronic Equipment, Instruments and Components",Electronic Equipment and Instruments,8131200,"Measuring, Analyzing, and Controlling Instruments",(Invalid Subsector ID),3829,Measuring and controlling devices ,Public Company,45203010,Radio and Television Broadcasting and Wireless Communications Equipment Manufacturing (334220)
NYSE:HII,Aerospace & Defense ,Construction Machinery and Heavy Trucks ,Ship building and repairing (3731),Ship and boat building and repairing (3730),Industrials,Capital Goods,Aerospace and Defense,Aerospace and Defense,9551739,Aerospace and Defense Maintenance and Services,(Invalid Subsector ID),3730,Ship and boat building and repairing,Public Company,20101010,Ship Building and Repairing (336611)
NYSE:WU,Consumer Finance ,Specialized Finance ,Functions related to deposit banking (6099),Business credit institutions (6150),Information Technology,Software and Services,IT Services,Data Processing and Outsourced Services,0,0,(Invalid Subsector ID),6099,Functions related to deposit banking,Public Company,45102020,"Financial Transactions Processing, Reserve, and Clearinghouse Activities (522320)"
NYSE:ARMK,Restaurants ,Food Retail ,Eating places (5812),Grocery stores (5411),Consumer Discretionary,Consumer Services,"Hotels, Restaurants and Leisure",Restaurants,4214900,Beverage and Tobacco Bars,(Invalid Subsector ID),5812,Eating places,Public Company,25301040,Full-Service Restaurants (722511)
NYSE:MSCI,Specialized Finance ,Asset Management & Custody Banks ,Business credit institutions (6150),Investment advice (6282),Financials,Diversified Financials,Capital Markets,Financial Exchanges and Data,7132230,Security and Commodity Exchanges,(Invalid Subsector ID),6282,Investment advice,Public Company,40203040,Nondepository Credit Intermediation (5222)
NYSE:TFX,Construction Machinery and Heavy Trucks ,Auto Parts & Equipment ,Ship and boat building and repairing (3730),Motor vehicle parts and accessories (3714),Healthcare,Healthcare Equipment and Services,Healthcare Equipment and Supplies,Healthcare Equipment,6021100,Medical Equipment,(Invalid Subsector ID),3841,Surgical and medical instruments,Public Company,35101010,Ship and Boat Building (3366)
NasdaqGS:CDK,Application Software ,IT Consulting & Other Services ,Prepackaged software (7372),Computer related services (7379),Information Technology,Software and Services,Software,Application Software,8041350,Enterprise Software,(Invalid Subsector ID),7372,Prepackaged software,Public Company,45103010,Software Publishers (511210)
NYSE:VAL,(Invalid Identifier),(Invalid Identifier),(Invalid Identifier),(Invalid Identifier),(Invalid Identifier),(Invalid Identifier),(Invalid Identifier),(Invalid Identifier),(Invalid Identifier),(Invalid Identifier),(Invalid Identifier),(Invalid Identifier),(Invalid Identifier),(Invalid Identifier),(Invalid Identifier),(Invalid Identifier)
NYSE:LUK,Integrated Telecommunication Services ,Integrated Telecommunication Services ,Communication services  (4899),Communication services  (4899),Financials,Diversified Financials,Diversified Financial Services,Multi-Sector Holdings,0,0,(Invalid Subsector ID),2011,Meat packing plants,Public Company,40201030,All Other Telecommunications (517919)
NasdaqGS:SNI,Broadcasting ,Internet Software & Services ,Television broadcasting stations (4833),Information retrieval services (7375),Consumer Discretionary,Media,Media,Broadcasting,4312101,Television,(Invalid Subsector ID),4833,Television broadcasting stations,Public Company,25401020,Television Broadcasting (515120)
NYSE:Y,0,0,0,0,Financials,Insurance,Insurance,Reinsurance,7215300,Casualty Reinsurance Carriers,(Invalid Subsector ID),6331,"Fire, marine, and casualty insurance",Public Company,40301050,0
NYSE:NVR,Homebuilding ,0,Building construction  general contractors and operative builders (1500),0,Consumer Discretionary,Consumer Durables and Apparel,Household Durables,Homebuilding,4113100,"Residential Construction, General Contractors and Operative Builders",(Invalid Subsector ID),1531,Operative builders,Public Company,25201030,Residential Building Construction (23611)
NYSE:GPS,Apparel Retail ,Apparel Retail ,Men's and boys' clothing stores (5611),Women's clothing stores (5621),Consumer Discretionary,Retailing,Specialty Retail,Apparel Retail,0,0,(Invalid Subsector ID),5651,Family clothing stores,Public Company,25504010,Men's Clothing Stores (448110)
NYSE:VAR,Health Care Equipment ,Health Care Technology ,"Surgical, medical, and dental instruments and supplies (3840)",Prepackaged software (7372),Healthcare,Healthcare Equipment and Services,Healthcare Equipment and Supplies,Healthcare Equipment,6021125,"Medical Testing, Analyzing, and Diagnostic Equipment",(Invalid Subsector ID),3845,Electromedical equipment,Public Company,35101010,Medical Equipment and Supplies Manufacturing (33911)
NYSE:BWA,Auto Parts & Equipment ,Auto Parts & Equipment ,Motor vehicle parts and accessories (3714),Motor vehicle parts and accessories (3714),Consumer Discretionary,Automobiles and Components,Auto Components,Auto Parts and Equipment,4012250,Exhaust and Emission Controls,(Invalid Subsector ID),3714,Motor vehicle parts and accessories,Public Company,25101010,Motor Vehicle Gasoline Engine and Engine Parts Manufacturing (33631)
NYSE:TMK,0,0,0,0,Financials,Insurance,Insurance,Life and Health Insurance,7212200,Health and Medical Insurance,(Invalid Subsector ID),6311,Life insurance,Public Company,40301020,0
NYSE:BR,Internet Software & Services ,Data Processing & Outsourced Services ,Information retrieval services (7375),Data processing and preparation (7374),Information Technology,Software and Services,IT Services,Data Processing and Outsourced Services,0,0,(Invalid Subsector ID),7373,Computer integrated systems design,Public Company,45102020,"Data Processing, Hosting, and Related Services (518)"
NYSE:SHOP,Internet Software & Services ,Internet and Direct Marketing Retail ,Information retrieval services (7375),Nonstore retailers (5960),Information Technology,Software and Services,Internet Software and Services,Internet Software and Services,8021200,Online Services,(Invalid Subsector ID),7370,"Computer programming, data processing, and other computer related services",Public Company,45101010,Internet Publishing and Broadcasting and Web Search Portals (519130)
NYSE:ALLY,Consumer Finance ,Specialized Finance ,Personal credit institutions (6141),Business credit institutions (6150),Financials,Diversified Financials,Consumer Finance,Consumer Finance,7121100,Personal Credit Agencies,(Invalid Subsector ID),6172,Finance lessors,Public Company,40202010,Nondepository Credit Intermediation (5222)
NYSE:VEEV,Health Care Technology ,0,Prepackaged software (7372),0,Healthcare,Healthcare Equipment and Services,Health Care Technology,Health Care Technology,8041963,Healthcare Industry Software,(Invalid Subsector ID),7370,"Computer programming, data processing, and other computer related services",Public Company,35103010,Software Publishers (511210)
NYSE:AFG,0,0,0,0,Financials,Insurance,Insurance,Multi-line Insurance,0,0,(Invalid Subsector ID),6331,"Fire, marine, and casualty insurance",Public Company,40301030,0
NYSE:SEE,Metal & Glass Containers ,Industrial Machinery ,Miscellaneous plastics products (3080),Packaging machinery (3565),Materials,Materials,Containers and Packaging,Paper Packaging,2042100,Paperboard Containers And Boxes,(Invalid Subsector ID),2670,"Converted paper and paperboard products, except containers and boxes",Public Company,15103020,Plastics Product Manufacturing (3261)
NasdaqGS:OTEX,Application Software ,IT Consulting & Other Services ,Prepackaged software (7372),Computer related services (7379),Information Technology,Software and Services,Software,Application Software,8041350,Enterprise Software,(Invalid Subsector ID),7370,"Computer programming, data processing, and other computer related services",Public Company,45103010,Software Publishers (511210)
NYSE:ATO,Gas Utilities ,0,Gas production and distribution (4920),0,Utilities,Utilities,Gas Utilities,Gas Utilities,1033200,Oil and Gas Distribution,(Invalid Subsector ID),4924,Natural gas distribution,Public Company,55102010,Natural Gas Distribution (221210)
NasdaqGS:CSGP,Internet Software & Services ,Research & Consulting Services ,Information retrieval services (7375),Management and public relations services (8740),Information Technology,Software and Services,Internet Software and Services,Internet Software and Services,8021200,Online Services,(Invalid Subsector ID),7370,"Computer programming, data processing, and other computer related services",Public Company,45101010,Other Information Services (5191)
NYSE:UGI,0,0,0,0,Utilities,Utilities,Gas Utilities,Gas Utilities,1033200,Oil and Gas Distribution,(Invalid Subsector ID),4932,Gas and other services combined,Public Company,55102010,0
NasdaqGS:HDS,Trading Companies & Distributors ,Trading Companies & Distributors ,Electrical apparatus and equipment (5063),"Hardware, and plumbing and heating equipment and supplies - wholesale (5070)",Industrials,Capital Goods,Trading Companies and Distributors,Trading Companies and Distributors,4411400,Building Product Distribution,(Invalid Subsector ID),5000,Durable goods - wholesale,Public Company,20107010,"Electrical Apparatus and Equipment, Wiring Supplies, and Related Equipment Merchant Wholesalers (423610)"
NasdaqGS:TSRO,Pharmaceuticals ,Pharmaceuticals ,Drugs (2830),Drugs (2830),Healthcare,"Pharmaceuticals, Biotechnology and Life Sciences",Biotechnology,Biotechnology,0,0,(Invalid Subsector ID),2836,Biological products except diagnostic,Public Company,35201010,Pharmaceutical and Medicine Manufacturing (32541)
NasdaqGS:FFIV,Communications Equipment ,Internet Software & Services ,Telephone and telegraph apparatus (3661),Information retrieval services (7375),Information Technology,Technology Hardware and Equipment,Communications Equipment,Communications Equipment,8111200,Networking Equipment,(Invalid Subsector ID),7373,Computer integrated systems design,Public Company,45201020,Telephone Apparatus Manufacturing (334210)
NYSE:INGR,Agricultural Products ,Packaged Foods & Meats ,Sugar and confectionery products (2060),Sugar and confectionery products (2060),Consumer Staples,"Food, Beverage and Tobacco",Food Products,Agricultural Products,0,0,(Invalid Subsector ID),2040,Grain mill products,Public Company,30202010,Sugar and Confectionery Product Manufacturing (3113)
NasdaqGS:AKAM,Internet Software & Services ,Internet Software & Services ,Prepackaged software (7372),Information retrieval services (7375),Information Technology,Software and Services,Internet Software and Services,Internet Software and Services,8021100,Internet Software,(Invalid Subsector ID),7370,"Computer programming, data processing, and other computer related services",Public Company,45101010,Software Publishers (511210)
NasdaqGS:STLD,0,0,0,0,Materials,Materials,Metals and Mining,Steel,2055006,"Steel Works, Blast Furnaces, And Finishing Mills",(Invalid Subsector ID),3312,Blast furnaces and steel mills,Public Company,15104050,0
NYSE:WRB,Property & Casualty Insurance ,Property & Casualty Insurance ,"Fire, marine, and casualty insurance (6331)","Fire, marine, and casualty insurance (6331)",Financials,Insurance,Insurance,Property and Casualty Insurance,7214100,Casualty,(Invalid Subsector ID),6331,"Fire, marine, and casualty insurance",Public Company,40301040,Direct Property and Casualty Insurance Carriers (524126)
NYSE:UAA,0,0,0,0,Consumer Discretionary,Consumer Durables and Apparel,"Textiles, Apparel and Luxury Goods","Apparel, Accessories and Luxury Goods",4131200,Accessories,(Invalid Subsector ID),2300,Apparel and other finished products made from fabrics and similar materials,Public Company,25203010,0
NYSE:MTN,Real Estate Development ,Real Estate Operating Companies ,Subdividers and developers (6552),Real estate agents and managers (6531),Consumer Discretionary,Consumer Services,"Hotels, Restaurants and Leisure",Leisure Facilities,4213100,Amusement And Recreation Services,(Invalid Subsector ID),7990,Miscellaneous amusement and recreation services,Public Company,25301030,Land Subdivision (237210)
NYSE:IEX,Industrial Machinery ,0,Special industry machinery (3559),0,Industrials,Capital Goods,Machinery,Industrial Machinery,3072550,"Industrial Heating, Ventilation, Air Conditioning, and Refrigeration Equipment and Supplies",(Invalid Subsector ID),3561,Pumps and pumping equipment,Public Company,20106020,Other Industrial Machinery Manufacturing (333249)
NasdaqGS:ZION,Regional Banks ,Asset Management & Custody Banks ,Commercial banks (6020),Investment offices (6720),Financials,Banks,Banks,Regional Banks,7012200,National and State Commercial Banks,(Invalid Subsector ID),6020,Commercial banks,Public Company,40101015,Commercial Banking (522110)
NasdaqGS:IAC,0,0,0,0,Information Technology,Software and Services,Internet Software and Services,Internet Software and Services,8021200,Online Services,(Invalid Subsector ID),7370,"Computer programming, data processing, and other computer related services",Public Company,45101010,0
NYSE:MOS,Fertilizers & Agricultural Chemicals ,Fertilizers & Agricultural Chemicals ,Phosphatic fertilizers (2874),Nitrogenous fertilizers (2873),Materials,Materials,Chemicals,Fertilizers and Agricultural Chemicals,2023100,Nitrogenous Fertilizers,(Invalid Subsector ID),2870,Agricultural chemicals,Public Company,15101030,Phosphatic Fertilizer Manufacturing (325312)
NYSE:NI,0,0,0,0,Utilities,Utilities,Multi-Utilities,Multi-Utilities,0,0,(Invalid Subsector ID),4932,Gas and other services combined,Public Company,55103010,0
NYSE:CC,Specialty Chemicals ,0,Cyclic crudes and intermediates (2865),0,Materials,Materials,Chemicals,Diversified Chemicals,0,0,(Invalid Subsector ID),2860,Industrial organic chemicals,Public Company,15101020,Synthetic Dye and Pigment Manufacturing (325130)
NYSE:RGA,Reinsurance ,Reinsurance ,Life insurance (6311),Accident and health insurance (6321),Financials,Insurance,Insurance,Reinsurance,7215300,Casualty Reinsurance Carriers,(Invalid Subsector ID),6311,Life insurance,Public Company,40301050,Reinsurance Carriers (524130)
NYSE:LDOS,IT Consulting & Other Services ,Data Processing & Outsourced Services ,Computer related services (7379),Data processing and preparation (7374),Information Technology,Software and Services,IT Services,IT Consulting and Other Services,8031100,Information Technology (IT) Consulting,(Invalid Subsector ID),7373,Computer integrated systems design,Public Company,45102010,Computer Systems Design and Related Services (5415)
NasdaqGS:CGNX,0,0,0,0,Information Technology,Technology Hardware and Equipment,"Electronic Equipment, Instruments and Components",Electronic Equipment and Instruments,8131200,"Measuring, Analyzing, and Controlling Instruments",(Invalid Subsector ID),3823,Process control instruments,Public Company,45203010,0
NasdaqGS:GT,Tires & Rubber ,Specialized Consumer Services ,Tires and inner tubes (3011),"Automotive repair, services, and parking (7500)",Consumer Discretionary,Automobiles and Components,Auto Components,Tires and Rubber,4013100,Motor Vehicle Tires,(Invalid Subsector ID),3011,Tires and inner tubes,Public Company,25101020,Tire Manufacturing (except Retreading) (326211)
NasdaqGS:IEP,0,0,0,0,Industrials,Capital Goods,Industrial Conglomerates,Industrial Conglomerates,0,0,(Invalid Subsector ID),9997,Conglomerates,Public Company,20105010,0
NYSE:PVH,Apparel Retail ,Apparel Retail ,Men's and boys' clothing stores (5611),Miscellaneous apparel and accessory stores (5699),Consumer Discretionary,Consumer Durables and Apparel,"Textiles, Apparel and Luxury Goods","Apparel, Accessories and Luxury Goods",4131200,Accessories,(Invalid Subsector ID),2300,Apparel and other finished products made from fabrics and similar materials,Public Company,25203010,Men's Clothing Stores (448110)
NasdaqGS:JKHY,Data Processing & Outsourced Services ,0,Data processing and preparation (7374),0,Information Technology,Software and Services,IT Services,Data Processing and Outsourced Services,8032100,Infrastructure Services,(Invalid Subsector ID),7373,Computer integrated systems design,Public Company,45102020,"Data Processing, Hosting, and Related Services (518210)"
NasdaqGS:EWBC,Regional Banks ,0,Commercial banks (6020),0,Financials,Banks,Banks,Regional Banks,7012200,National and State Commercial Banks,(Invalid Subsector ID),6020,Commercial banks,Public Company,40101015,Commercial Banking (522110)
NYSE:FL,Apparel Retail ,Apparel Retail ,Shoe stores (5661),Apparel and accessory stores (5600),Consumer Discretionary,Retailing,Specialty Retail,Apparel Retail,4441150,Boys' Apparel Stores,(Invalid Subsector ID),5661,Shoe stores,Public Company,25504010,Shoe Stores (448210)
NYSE:WAB,0,0,0,0,Industrials,Capital Goods,Machinery,Construction Machinery and Heavy Trucks,3241300,Railroad Equipment,(Invalid Subsector ID),3743,Railroad equipment,Public Company,20106010,0
NYSE:SQ,Data Processing & Outsourced Services ,Application Software ,Data processing and preparation (7374),Prepackaged software (7372),Information Technology,Software and Services,IT Services,Data Processing and Outsourced Services,0,0,(Invalid Subsector ID),7374,Data processing and preparation,Public Company,45102020,Software Publishers (511210)
NYSE:ZAYO,Alternative Carriers ,Internet Software & Services ,Communication services  (4899),Information retrieval services (7375),Telecommunication Services,Telecommunication Services,Diversified Telecommunication Services,Alternative Carriers,9021100,Broadband Telecommunications Services,(Invalid Subsector ID),4899,Communication services ,Public Company,50101010,Wired Telecommunications Carriers (517110)
NYSE:PE,Oil & Gas Exploration & Production ,0,Crude petroleum and natural gas (1311),0,Energy,Energy,"Oil, Gas and Consumable Fuels",Oil and Gas Exploration and Production,1032200,Oil and Gas Production,(Invalid Subsector ID),1311,Crude petroleum and natural gas,Public Company,10102020,Oil and Gas Extraction (21111)
NasdaqGS:NWSA,Publishing ,Publishing ,"Printing, publishing, and allied industries (2700)",Miscellaneous publishing (2741),Consumer Discretionary,Media,Media,Publishing,4314100,Printed Media Publishing,(Invalid Subsector ID),2711,Newspapers,Public Company,25401040,"Newspaper, Periodical, Book, and Directory Publishers (5111)"
NYSE:CCK,Metal & Glass Containers ,Diversified Metals & Mining ,Metal cans and shipping containers (3410),Fabricated structural metal products (3440),Materials,Materials,Containers and Packaging,Metal and Glass Containers,2041200,Glass Packaging,(Invalid Subsector ID),3411,Metal cans,Public Company,15103010,"Metal Can, Box, and Other Metal Container (Light Gauge) Manufacturing (33243)"
NYSE:TRU,Research & Consulting Services ,Internet Software & Services ,Credit reporting services (7323),Information retrieval services (7375),Industrials,Commercial and Professional Services,Professional Services,Research and Consulting Services,0,0,(Invalid Subsector ID),7323,Credit reporting services,Public Company,20202020,Business Support Services (5614)
NYSE:WCG,Managed Health Care ,Life & Health Insurance ,Offices of health practitioners (8049),Hospital and medical service plans (6324),Healthcare,Healthcare Equipment and Services,Healthcare Providers and Services,Managed Healthcare,6034100,Medical Practice Organizations,(Invalid Subsector ID),6324,Hospital and medical service plans,Public Company,35102030,Offices of All Other Miscellaneous Health Practitioners (621399)
NasdaqGS:ZG,Internet Software & Services ,Advertising ,Information retrieval services (7375),Advertising agencies (7311),Information Technology,Software and Services,Internet Software and Services,Internet Software and Services,8021200,Online Services,(Invalid Subsector ID),7370,"Computer programming, data processing, and other computer related services",Public Company,45101010,"Data Processing, Hosting, and Related Services (518)"
NYSE:AXTA,Specialty Chemicals ,0,Paints and allied products (2851),0,Materials,Materials,Chemicals,Specialty Chemicals,2024700,Industrial Coatings,(Invalid Subsector ID),2851,Paints and allied products,Public Company,15101050,Paint and Coating Manufacturing (325510)
NYSE:HBI,"Apparel, Accessories & Luxury Goods ",Footwear ,Apparel and other finished products made from fabrics and similar materials (2300),"Footwear, except rubber (3149)",Consumer Discretionary,Consumer Durables and Apparel,"Textiles, Apparel and Luxury Goods","Apparel, Accessories and Luxury Goods",4131100,Apparel,(Invalid Subsector ID),2250,Knitting mills,Public Company,25203010,Cut and Sew Apparel Manufacturing (3152)
NasdaqGS:SSNC,0,0,0,0,Information Technology,Software and Services,Software,Application Software,8041350,Enterprise Software,(Invalid Subsector ID),7372,Prepackaged software,Public Company,45103010,0
NasdaqGS:MIDD,Industrial Machinery ,Industrial Machinery ,Food products machinery (3556),Refrigeration and heating equipment (3585),Industrials,Capital Goods,Machinery,Industrial Machinery,3072500,Food and Beverage Machinery,(Invalid Subsector ID),3580,Refrigeration and service industry machinery,Public Company,20106020,Food Product Machinery Manufacturing (333241)
NasdaqGS:NDSN,Industrial Machinery ,Industrial Machinery ,Metalworking machinery and equipment (3540),Paper industries machinery (3554),Industrials,Capital Goods,Machinery,Industrial Machinery,3072350,Metalworking Machinery and Equipment,(Invalid Subsector ID),3569,General industrial machinery,Public Company,20106020,Metalworking Machinery Manufacturing (33351)
NasdaqGS:UHAL,Diversified Support Services ,Trading Companies & Distributors ,Public warehousing and storage (4220),Miscellaneous equipment rental and leasing (7350),Industrials,Transportation,Road and Rail,Trucking,4444820,Motor Vehicle Rental and Leasing,(Invalid Subsector ID),7510,"Automotive rental and leasing, without drivers",Public Company,20304020,Warehousing and Storage (4931)
NasdaqGS:SBNY,Regional Banks ,0,Commercial banks (6020),0,Financials,Banks,Banks,Regional Banks,7012200,National and State Commercial Banks,(Invalid Subsector ID),6020,Commercial banks,Public Company,40101015,Commercial Banking (522110)
NYSE:AES,0,0,0,0,Utilities,Utilities,Independent Power and Renewable Electricity Producers,Independent Power Producers and Energy Traders,0,0,(Invalid Subsector ID),4991,Cogeneration services and small power producers,Public Company,55105010,0
NasdaqGS:MAT,Leisure Products ,0,Sporting and athletic goods  (3949),0,Consumer Discretionary,Consumer Durables and Apparel,Leisure Products,Leisure Products,4121200,Sporting and Recreational Goods,(Invalid Subsector ID),3942,Dolls and stuffed toys,Public Company,25202010,Sporting and Athletic Goods Manufacturing (339920)
NYSE:LII,Industrial Machinery ,0,"Heating equipment, except electric (3433)",0,Industrials,Capital Goods,Building Products,Building Products,0,0,(Invalid Subsector ID),3585,Refrigeration and heating equipment,Public Company,20102010,"Ventilation, Heating, Air-Conditioning, and Commercial Refrigeration Equipment Manufacturing (33341)"
NasdaqGS:WOOF,Healthcare Services ,0,Medical laboratories (8071),0,Healthcare,Healthcare Equipment and Services,Healthcare Providers and Services,Healthcare Facilities,6033400,Veterinary Services and Animal Hospitals,(Invalid Subsector ID),700,Agricultural services,Public Company,35102020,Medical Laboratories (621511)
NYSE:AVY,Paper Packaging ,Commodity Chemicals ,"Converted paper and paperboard products, except containers and boxes (2670)","Plastic material, synthetic resins, synthetic rubber, cellulose, and other manmade fibers, except glass (2820)",Materials,Materials,Containers and Packaging,Paper Packaging,2042200,Converted Paper And Paperboard Products,(Invalid Subsector ID),2670,"Converted paper and paperboard products, except containers and boxes",Public Company,15103020,Paper Bag and Coated and Treated Paper Manufacturing (32222)
