tickerID,IQ_BUS_SEG_PRIMARY_PIC_ABS,IQ_BUS_SEG_SECONDARY_PIC_ABS,IQ_BUS_SEG_PRIMARY_SIC_ABS,IQ_BUS_SEG_SECONDARY_SIC_ABS,IQ_INDUSTRY_SECTOR,IQ_INDUSTRY_GROUP,IQ_INDUSTRY,IQ_PRIMARY_INDUSTRY,IQ_PRIMARY_INDUSTRY_SUBSECTOR5_ID,IQ_PRIMARY_INDUSTRY_SUBSECTOR5_NAME,IQ_PRIMARY_INDUSTRY_SUBSECTOR6_ID,IQ_PRIMARY_SIC_CODE,IQ_PRIMARY_SIC_INDUSTRY,IQ_COMPANY_TYPE,IQ_PICS_CODE,IQ_BUS_SEG_NAIC_ABS
NasdaqGS:PSDO,IT Consulting & Other Services ,Internet Software & Services ,Computer related services (7379),Information retrieval services (7375),Information Technology,Software and Services,IT Services,IT Consulting and Other Services,8031100,Information Technology (IT) Consulting,(Invalid Subsector ID),7370,"Computer programming, data processing, and other computer related services",Public Company,45102010,Computer Systems Design and Related Services (5415)
NasdaqGS:AIMC,Industrial Machinery ,Auto Parts & Equipment ,General industrial machinery and equipment (3560),Motor vehicle parts and accessories (3714),Industrials,Capital Goods,Machinery,Industrial Machinery,3072001,Machinery Components,(Invalid Subsector ID),3560,General industrial machinery and equipment,Public Company,20106020,Ball and Roller Bearing Manufacturing (332991)
NasdaqGS:SCSS,Homefurnishing Retail ,Home Furnishings ,Furniture stores (5712),Mattresses and bedsprings (2515),Consumer Discretionary,Retailing,Specialty Retail,Home Furnishing Retail,4444101,Furniture Stores,(Invalid Subsector ID),2510,Household furniture,Public Company,25504060,Furniture Stores (442110)
TSX:AAV,Oil & Gas Exploration & Production ,0,Crude petroleum and natural gas (1311),0,Energy,Energy,"Oil, Gas and Consumable Fuels",Oil and Gas Exploration and Production,1032200,Oil and Gas Production,(Invalid Subsector ID),1311,Crude petroleum and natural gas,Public Company,10102020,Oil and Gas Extraction (21111)
NasdaqGS:MINI,0,0,0,0,Industrials,Commercial and Professional Services,Commercial Services and Supplies,Diversified Support Services,3211600,Warehousing and Storage,(Invalid Subsector ID),7359,Equipment rental and leasing,Public Company,20201070,0
NYSE:VSTO,Aerospace & Defense ,Aerospace & Defense ,"Ordnance and accessories, except vehicles and guided missiles (3480)","Ordnance and accessories, except vehicles and guided missiles (3480)",Consumer Discretionary,Consumer Durables and Apparel,Leisure Products,Leisure Products,4121200,Sporting and Recreational Goods,(Invalid Subsector ID),3480,"Ordnance and accessories, except vehicles and guided missiles",Public Company,25202010,All Other Fabricated Metal Product Manufacturing (33299)
NYSE:ACCO,Office Services & Supplies ,0,Manufacturing industries  (3999),0,Industrials,Commercial and Professional Services,Commercial Services and Supplies,Office Services and Supplies,3115700,Office Products,(Invalid Subsector ID),2780,"Blankbooks, looseleaf binders, and bookbinding and related work",Public Company,20201060,Office Supplies (except Paper) Manufacturing (33994)
NYSE:ITGR,Health Care Equipment ,Health Care Supplies ,"Surgical, medical, and dental instruments and supplies (3840)",Surgical and medical instruments (3841),Healthcare,Healthcare Equipment and Services,Healthcare Equipment and Supplies,Healthcare Equipment,6021200,Therapeutic Devices,(Invalid Subsector ID),3845,Electromedical equipment,Public Company,35101010,Medical Equipment and Supplies Manufacturing (33911)
NYSE:MCRN,Industrial Machinery ,Diversified Support Services ,Special industry machinery (3559),Miscellaneous repair services (7600),Industrials,Capital Goods,Machinery,Industrial Machinery,3072100,Chemical Processing Machinery and Equipment,(Invalid Subsector ID),3559,Special industry machinery,Public Company,20106020,Other Industrial Machinery Manufacturing (333249)
NasdaqGS:AAWW,Aerospace & Defense ,0,"Airports, flying fields, and services (4581)",0,Industrials,Transportation,Air Freight and Logistics,Air Freight and Logistics,3211200,Charter Freight Air Transportation,(Invalid Subsector ID),4522,"Air transportation, nonscheduled",Public Company,20301010,Other Support Activities for Air Transportation (488190)
NYSE:ABG,0,0,0,0,Consumer Discretionary,Retailing,Specialty Retail,Automotive Retail,4444800,"Motor Vehicle Parts, Accessories, and Related Retail Services",(Invalid Subsector ID),5500,Automotive dealers and gasoline service stations,Public Company,25504050,0
NYSE:HY,Construction Machinery and Heavy Trucks ,0,Industrial trucks and tractors (3537),0,Industrials,Capital Goods,Machinery,Industrial Machinery,0,0,(Invalid Subsector ID),3537,Industrial trucks and tractors,Public Company,20106020,"Industrial Truck, Tractor, Trailer, and Stacker Machinery Manufacturing (333924)"
NasdaqGM:LOXO,Biotechnology ,Pharmaceuticals ,Pharmaceutical preparations (2834),Pharmaceutical preparations (2834),Healthcare,"Pharmaceuticals, Biotechnology and Life Sciences",Biotechnology,Biotechnology,0,0,(Invalid Subsector ID),2836,Biological products except diagnostic,Public Company,35201010,Pharmaceutical Preparation Manufacturing (325412)
NYSE:KREF,0,0,0,0,Financials,Diversified Financials,Mortgage Real Estate Investment Trusts (REITs),Mortgage REITs,0,0,(Invalid Subsector ID),6798,Real estate investment trusts,Public Company,40204010,0
NYSE:FCF,Regional Banks ,Asset Management & Custody Banks ,Commercial banks (6020),Investment advice (6282),Financials,Banks,Banks,Regional Banks,7012200,National and State Commercial Banks,(Invalid Subsector ID),6020,Commercial banks,Public Company,40101015,Commercial Banking (522110)
NYSE:EBS,Biotechnology ,Pharmaceuticals ,Biological products except diagnostic (2836),Pharmaceutical preparations (2834),Healthcare,"Pharmaceuticals, Biotechnology and Life Sciences",Biotechnology,Biotechnology,0,0,(Invalid Subsector ID),2836,Biological products except diagnostic,Public Company,35201010,Biological Product (except Diagnostic) Manufacturing (325414)
NYSE:EPE,Oil & Gas Exploration & Production ,0,Crude petroleum and natural gas (1311),0,Energy,Energy,"Oil, Gas and Consumable Fuels",Oil and Gas Exploration and Production,1032200,Oil and Gas Production,(Invalid Subsector ID),1311,Crude petroleum and natural gas,Public Company,10102020,Oil and Gas Extraction (21111)
NYSE:EVTC,Internet Software & Services ,Consumer Finance ,Information retrieval services (7375),Functions related to deposit banking (6099),Information Technology,Software and Services,IT Services,Data Processing and Outsourced Services,8032100,Infrastructure Services,(Invalid Subsector ID),7374,Data processing and preparation,Public Company,45102020,"Data Processing, Hosting, and Related Services (518)"
NasdaqGS:HTLF,Regional Banks ,Asset Management & Custody Banks ,Commercial banks (6020),Investment offices (6720),Financials,Banks,Banks,Regional Banks,7012200,National and State Commercial Banks,(Invalid Subsector ID),6020,Commercial banks,Public Company,40101015,Commercial Banking (522110)
NYSE:WMS,Building Products ,Trading Companies & Distributors ,"Heating equipment, except electric and warm air; and plumbing fixtures (3430)",Lumber and other construction materials - wholesale (5030),Industrials,Capital Goods,Building Products,Building Products,3031400,Plumbing Fixtures and Equipment,(Invalid Subsector ID),3080,Miscellaneous plastics products,Public Company,20102010,Plumbing Fixture Fitting and Trim Manufacturing (332913)
TSX:SSO,Gold ,Silver ,Gold ores (1041),Silver ores (1044),Materials,Materials,Metals and Mining,Gold,2053010,Gold Ores,(Invalid Subsector ID),1040,Gold and silver ores,Public Company,15104030,Gold Ore Mining (212221)
NYSE:FTAI,Aerospace & Defense ,0,Aircraft (3721),0,Industrials,Capital Goods,Trading Companies and Distributors,Trading Companies and Distributors,3081200,Machinery Rental and Leasing,(Invalid Subsector ID),7359,Equipment rental and leasing,Public Company,20107010,Aircraft Manufacturing (336411)
NasdaqGS:FOXF,Auto Parts & Equipment ,Auto Parts & Equipment ,Motor vehicle parts and accessories (3714),Motor vehicle parts and accessories (3714),Consumer Discretionary,Automobiles and Components,Auto Components,Auto Parts and Equipment,4012800,Motor Vehicle Accessories,(Invalid Subsector ID),3751,"Motorcycles, bicycles, and parts",Public Company,25101010,Motor Vehicle Steering and Suspension Components (except Spring) Manufacturing (336330)
NYSE:TGI,Aerospace & Defense ,0,Aircraft and parts (3720),0,Industrials,Capital Goods,Aerospace and Defense,Aerospace and Defense,9551739,Aerospace and Defense Maintenance and Services,(Invalid Subsector ID),3728,Aircraft parts and equipment ,Public Company,20101010,Other Aircraft Parts and Auxiliary Equipment Manufacturing (336413)
NasdaqGM:FOLD,Pharmaceuticals ,Pharmaceuticals ,Drugs (2830),Drugs (2830),Healthcare,"Pharmaceuticals, Biotechnology and Life Sciences",Biotechnology,Biotechnology,0,0,(Invalid Subsector ID),2836,Biological products except diagnostic,Public Company,35201010,Pharmaceutical and Medicine Manufacturing (32541)
NYSE:GTT,Internet Software & Services ,Data Processing & Outsourced Services ,Information retrieval services (7375),Data processing and preparation (7374),Information Technology,Software and Services,Internet Software and Services,Internet Software and Services,8021200,Online Services,(Invalid Subsector ID),4899,Communication services ,Public Company,45101010,"Data Processing, Hosting, and Related Services (518)"
NYSE:CUDA,Systems Software ,0,Prepackaged software (7372),0,Information Technology,Software and Services,Software,Systems Software,8042150,Security Software,(Invalid Subsector ID),7370,"Computer programming, data processing, and other computer related services",Public Company,45103020,Software Publishers (511210)
NasdaqGS:SRCE,Regional Banks ,Asset Management & Custody Banks ,Commercial banks (6020),Investment offices (6720),Financials,Banks,Banks,Regional Banks,7012200,National and State Commercial Banks,(Invalid Subsector ID),6020,Commercial banks,Public Company,40101015,Commercial Banking (522110)
NYSE:TIME,Publishing ,0,"Printing, publishing, and allied industries (2700)",0,Consumer Discretionary,Media,Media,Publishing,4314100,Printed Media Publishing,(Invalid Subsector ID),2721,Periodicals,Public Company,25401040,"Newspaper, Periodical, Book, and Directory Publishers (5111)"
NasdaqGM:FIVN,Internet Software & Services ,Application Software ,Information retrieval services (7375),Prepackaged software (7372),Information Technology,Software and Services,Internet Software and Services,Internet Software and Services,8021200,Online Services,(Invalid Subsector ID),7370,"Computer programming, data processing, and other computer related services",Public Company,45101010,"Data Processing, Hosting, and Related Services (518)"
NasdaqGS:LORL,0,0,0,0,Consumer Discretionary,Media,Media,Cable and Satellite,0,0,(Invalid Subsector ID),4899,Communication services ,Public Company,25401025,0
NasdaqGS:SPNC,0,0,0,0,Healthcare,Healthcare Equipment and Services,Healthcare Equipment and Supplies,Healthcare Supplies,0,0,(Invalid Subsector ID),3845,Electromedical equipment,Public Company,35101020,0
NasdaqGS:SONC,Restaurants ,0,Eating places (5812),0,Consumer Discretionary,Consumer Services,"Hotels, Restaurants and Leisure",Restaurants,4214200,Limited Service Restaurants,(Invalid Subsector ID),5812,Eating places,Public Company,25301040,Limited-Service Restaurants (722513)
NYSE:PMT,Mortgage Real Estate Investment Trusts  (40204010),0,Real estate investment trusts (6798),0,Financials,Diversified Financials,Mortgage Real Estate Investment Trusts (REITs),Mortgage REITs,0,0,(Invalid Subsector ID),6798,Real estate investment trusts,Public Company,40204010,Other Financial Vehicles (525990)
NYSE:ELY,Leisure Products ,Internet and Direct Marketing Retail ,Sporting and athletic goods  (3949),Nonstore retailers (5960),Consumer Discretionary,Consumer Durables and Apparel,Leisure Products,Leisure Products,4121200,Sporting and Recreational Goods,(Invalid Subsector ID),3949,Sporting and athletic goods ,Public Company,25202010,Sporting and Athletic Goods Manufacturing (339920)
NasdaqGM:EGRX,Biotechnology ,Pharmaceuticals ,Biological products except diagnostic (2836),Drugs (2830),Healthcare,"Pharmaceuticals, Biotechnology and Life Sciences",Biotechnology,Biotechnology,0,0,(Invalid Subsector ID),2834,Pharmaceutical preparations,Public Company,35201010,Biological Product (except Diagnostic) Manufacturing (325414)
NYSE:CPK,0,0,0,0,Utilities,Utilities,Gas Utilities,Gas Utilities,1033200,Oil and Gas Distribution,(Invalid Subsector ID),4923,Gas transmission and distribution,Public Company,55102010,0
NasdaqGS:SMCI,"Technology Hardware, Storage and Peripherals ","Technology Hardware, Storage and Peripherals ",Computer and office equipment (3570),Computer storage devices (3572),Information Technology,Technology Hardware and Equipment,"Technology Hardware, Storage and Peripherals","Technology Hardware, Storage and Peripherals",8121200,Computer Components,(Invalid Subsector ID),3570,Computer and office equipment,Public Company,45202030,Electronic Computer Manufacturing (334111)
NasdaqGS:RAVN,Electronic Manufacturing Services ,0,Electronic components and accessories (3670),0,Industrials,Capital Goods,Industrial Conglomerates,Industrial Conglomerates,0,0,(Invalid Subsector ID),3080,Miscellaneous plastics products,Public Company,20105010,Semiconductor and Other Electronic Component Manufacturing (33441)
NYSE:FBP,Asset Management & Custody Banks ,0,Investment offices (6720),0,Financials,Banks,Banks,Regional Banks,7012200,National and State Commercial Banks,(Invalid Subsector ID),6020,Commercial banks,Public Company,40101015,Open-End Investment Funds (525910)
NYSE:NCS,Diversified Metals & Mining ,0,"Coating, engraving, and allied services (3470)",0,Industrials,Capital Goods,Building Products,Building Products,3031100,"Roofing, Siding, and Insulation Materials",(Invalid Subsector ID),3448,Prefabricated metal buildings,Public Company,20102010,"Coating, Engraving, Heat Treating, and Allied Activities (33281)"
NasdaqGS:EGHT,Semiconductors ,Systems Software ,Semiconductors and related devices (3674),Prepackaged software (7372),Information Technology,Software and Services,Software,Application Software,8041100,Office and Home Productivity Software,(Invalid Subsector ID),4899,Communication services ,Public Company,45103010,Semiconductor and Related Device Manufacturing (334413)
TSX:OR,Gold ,Diversified Metals & Mining ,Gold ores (1041),Metal mining (1000),Materials,Materials,Metals and Mining,Gold,2053010,Gold Ores,(Invalid Subsector ID),1040,Gold and silver ores,Public Company,15104030,Gold Ore Mining (212221)
NYSE:QUAD,Commercial Printing ,Specialty Chemicals ,Commercial printing (2750),Printing ink (2893),Industrials,Commercial and Professional Services,Commercial Services and Supplies,Commercial Printing,3111100,Printing Services,(Invalid Subsector ID),2750,Commercial printing,Public Company,20201010,Commercial Printing (except Screen and Books) (323111)
NasdaqGS:HUBG,0,0,0,0,Industrials,Transportation,Air Freight and Logistics,Air Freight and Logistics,0,0,(Invalid Subsector ID),4731,Freight transportation arrangement,Public Company,20301010,0
NasdaqGS:STBA,Investment Banking & Brokerage ,Asset Management & Custody Banks ,"Security and commodity brokers, dealers, exchanges, and services (6200)",Investment offices (6720),Financials,Banks,Banks,Regional Banks,7012200,National and State Commercial Banks,(Invalid Subsector ID),6020,Commercial banks,Public Company,40101015,Securities and Commodity Contracts Intermediation and Brokerage (5231)
NasdaqGS:KRNY,Thrifts & Mortgage Finance ,0,Savings institutions (6030),0,Financials,Banks,Thrifts and Mortgage Finance,Thrifts and Mortgage Finance,7013200,Savings Institutions,(Invalid Subsector ID),6035,Federal savings institutions,Public Company,40102010,Savings Institutions (522120)
NYSE:DPLO,Healthcare Services ,Drug Retail ,Health and allied services (8099),Drug stores and proprietary stores (5912),Healthcare,Healthcare Equipment and Services,Healthcare Providers and Services,Healthcare Services,0,0,(Invalid Subsector ID),5912,Drug stores and proprietary stores,Public Company,35102015,All Other Miscellaneous Ambulatory Health Care Services (621999)
AMEX:TMP,Regional Banks ,0,Commercial banks (6020),0,Financials,Banks,Banks,Regional Banks,0,0,(Invalid Subsector ID),6020,Commercial banks,Public Company,40101015,Commercial Banking (522110)
NasdaqGS:CVGW,Packaged Foods & Meats ,Food & Staples Retailing ,Food and kindred products (2000),Groceries and related products - wholesale (5140),Consumer Staples,"Food, Beverage and Tobacco",Food Products,Packaged Foods and Meats,5122200,Prepared and Preserved Foods,(Invalid Subsector ID),5140,Groceries and related products - wholesale,Public Company,30202030,Food Manufacturing (311)
NYSE:SWM,Paper Products ,Tobacco ,"Converted paper and paperboard products, except containers and boxes (2670)",Cigarettes (2111),Materials,Materials,Paper and Forest Products,Paper Products,2062400,Industrial Service Paper,(Invalid Subsector ID),2621,Paper mills,Public Company,15105020,Other Converted Paper Product Manufacturing (32229)
NasdaqGS:IPXL,Pharmaceuticals ,Pharmaceuticals ,Drugs (2830),Pharmaceutical preparations (2834),Healthcare,"Pharmaceuticals, Biotechnology and Life Sciences",Pharmaceuticals,Pharmaceuticals,6121140,Non-Prescription Drugs,(Invalid Subsector ID),2834,Pharmaceutical preparations,Public Company,35202010,Pharmaceutical and Medicine Manufacturing (32541)
NasdaqGS:PRIM,Construction & Engineering ,Construction & Engineering ,Heavy construction other than building construction  contractors (1600),"Engineering, architectural, and surveying services (8710)",Industrials,Capital Goods,Construction and Engineering,Construction and Engineering,3041100,Commercial Construction and Engineering,(Invalid Subsector ID),1623,"Water, sewer, and utility lines",Public Company,20103010,Heavy and Civil Engineering Construction (237)
NYSE:YEXT,Internet Software & Services ,0,Information retrieval services (7375),0,Information Technology,Software and Services,Internet Software and Services,Internet Software and Services,8021200,Online Services,(Invalid Subsector ID),7370,"Computer programming, data processing, and other computer related services",Public Company,45101010,"Data Processing, Hosting, and Related Services (518)"
NasdaqGM:MB,Internet Software & Services ,0,Information retrieval services (7375),0,Information Technology,Software and Services,Internet Software and Services,Internet Software and Services,8021200,Online Services,(Invalid Subsector ID),7370,"Computer programming, data processing, and other computer related services",Public Company,45101010,"Data Processing, Hosting, and Related Services (518)"
NasdaqGS:DERM,Pharmaceuticals ,0,Drugs (2830),0,Healthcare,"Pharmaceuticals, Biotechnology and Life Sciences",Pharmaceuticals,Pharmaceuticals,6121100,Pharmaceutical Products,(Invalid Subsector ID),2836,Biological products except diagnostic,Public Company,35202010,Pharmaceutical and Medicine Manufacturing (32541)
NasdaqGS:PATK,Building Products ,Forest Products ,Fabricated rubber products (3069),Miscellaneous wood products (2490),Industrials,Capital Goods,Building Products,Building Products,0,0,(Invalid Subsector ID),2430,"Millwork, veneer, plywood, and structural wood members",Public Company,20102010,All Other Plastics Product Manufacturing (326199)
TSX:PD,Oil & Gas Equipment & Services ,Oil & Gas Equipment & Services ,Oil and gas field services (1380),Oil and gas field services (1380),Energy,Energy,Energy Equipment and Services,Oil and Gas Drilling,1021100,Oil Rig Services,(Invalid Subsector ID),1381,Drilling oil and gas wells,Public Company,10101010,Support Activities for Oil and Gas Operations (213112)
NYSE:PGEM,0,0,0,0,Industrials,Capital Goods,Building Products,Building Products,3031100,"Roofing, Siding, and Insulation Materials",(Invalid Subsector ID),2430,"Millwork, veneer, plywood, and structural wood members",Public Company,20102010,0
NYSE:ELF,Personal Products ,Specialty Stores ,Toilet preparations (2844),Miscellaneous retail stores (5999),Consumer Staples,Household and Personal Products,Personal Products,Personal Products,5221200,Beauty Care Products,(Invalid Subsector ID),2844,Toilet preparations,Public Company,30302010,Toilet Preparation Manufacturing (325620)
NYSE:AIR,Aerospace & Defense ,0,Aircraft and parts (3720),0,Industrials,Capital Goods,Aerospace and Defense,Aerospace and Defense,9551739,Aerospace and Defense Maintenance and Services,(Invalid Subsector ID),5080,"Machinery, equipment, and supplies - wholesale",Public Company,20101010,Aircraft Engine and Engine Parts Manufacturing (336412)
NasdaqGS:BSFT,Application Software ,Internet Software & Services ,Prepackaged software (7372),Information retrieval services (7375),Information Technology,Software and Services,Software,Application Software,8041350,Enterprise Software,(Invalid Subsector ID),7372,Prepackaged software,Public Company,45103010,Software Publishers (511210)
NYSE:CHGG,Education Services ,Internet Software & Services ,Educational services (8200),Information retrieval services (7375),Consumer Discretionary,Consumer Services,Diversified Consumer Services,Education Services,0,0,(Invalid Subsector ID),7370,"Computer programming, data processing, and other computer related services",Public Company,25302010,Educational Services (611)
NasdaqGS:SNHY,Industrial Machinery ,Building Products ,Pumps and pumping equipment (3561),"Heating equipment, except electric and warm air; and plumbing fixtures (3430)",Industrials,Capital Goods,Machinery,Industrial Machinery,3072001,Machinery Components,(Invalid Subsector ID),3490,Miscellaneous fabricated metal products,Public Company,20106020,Pump and Pumping Equipment Manufacturing (333911)
NasdaqGS:NOVT,0,0,0,0,Information Technology,Technology Hardware and Equipment,"Electronic Equipment, Instruments and Components",Electronic Equipment and Instruments,0,0,(Invalid Subsector ID),3690,"Miscellaneous electrical machinery, equipment, and supplies",Public Company,45203010,0
NYSE:HSC,0,0,0,0,Industrials,Capital Goods,Machinery,Industrial Machinery,3072550,"Industrial Heating, Ventilation, Air Conditioning, and Refrigeration Equipment and Supplies",(Invalid Subsector ID),3390,Miscellaneous primary metal products,Public Company,20106020,0
NYSE:SXI,Electrical Components & Equipment ,Electronic Components ,Electrical industrial apparatus (3620),Electronic components and accessories (3670),Industrials,Capital Goods,Machinery,Industrial Machinery,3072100,Chemical Processing Machinery and Equipment,(Invalid Subsector ID),3585,Refrigeration and heating equipment,Public Company,20106020,Electrical Equipment Manufacturing (33531)
NasdaqGS:TERP,Renewable Electricity ,0,Electric services (4911),0,Utilities,Utilities,Independent Power and Renewable Electricity Producers,Renewable Electricity,9521400,Electric Power By Solar Energy,(Invalid Subsector ID),4911,Electric services,Public Company,55105020,Solar Electric Power Generation (221114)
NYSE:CKH,Oil & Gas Equipment & Services ,Oil & Gas Equipment & Services ,Oil and gas field services (1380),Oil and gas field machinery (3533),Energy,Energy,Energy Equipment and Services,Oil and Gas Equipment and Services,0,0,(Invalid Subsector ID),4412,Deep sea foreign transportation of freight,Public Company,10101020,Support Activities for Oil and Gas Operations (213112)
NYSE:LADR,Mortgage Real Estate Investment Trusts  (40204010),0,Real estate investment trusts (6798),0,Financials,Diversified Financials,Mortgage Real Estate Investment Trusts (REITs),Mortgage REITs,0,0,(Invalid Subsector ID),6798,Real estate investment trusts,Public Company,40204010,Other Financial Vehicles (525990)
NYSE:PUMP,Oil & Gas Equipment & Services ,0,Oil and gas field services (1380),0,Energy,Energy,Energy Equipment and Services,Oil and Gas Equipment and Services,1022200,Oil and Gas Field Services,(Invalid Subsector ID),1389,Oil and gas field services,Public Company,10101020,Support Activities for Oil and Gas Operations (213112)
NYSE:HOME,Specialty Stores ,0,"Gift, novelty, and souvenir shops (5947)",0,Consumer Discretionary,Retailing,Specialty Retail,Home Furnishing Retail,0,0,(Invalid Subsector ID),5700,"Home furniture, furnishings, and equipment stores",Public Company,25504060,"Gift, Novelty, and Souvenir Stores (453220)"
NYSE:BMI,Electronic Equipment & Instruments ,Industrial Machinery ,Fluid meters and counting devices (3824),General industrial machinery and equipment (3560),Information Technology,Technology Hardware and Equipment,"Electronic Equipment, Instruments and Components",Electronic Equipment and Instruments,8131200,"Measuring, Analyzing, and Controlling Instruments",(Invalid Subsector ID),3824,Fluid meters and counting devices,Public Company,45203010,Totalizing Fluid Meter and Counting Device Manufacturing (334514)
NasdaqGS:BNCL,Thrifts & Mortgage Finance ,Asset Management & Custody Banks ,Savings institutions (6030),Investment advice (6282),Financials,Banks,Thrifts and Mortgage Finance,Thrifts and Mortgage Finance,7013200,Savings Institutions,(Invalid Subsector ID),6035,Federal savings institutions,Public Company,40102010,Savings Institutions (522120)
NYSE:NSH,Oil & Gas Storage & Transportation ,Oil & Gas Refining & Marketing ,"Pipelines, except natural gas (4610)",Petroleum refining (2911),Energy,Energy,"Oil, Gas and Consumable Fuels",Oil and Gas Storage and Transportation,1033300,Oil and Gas Pipelines,(Invalid Subsector ID),5171,Petroleum bulk stations and terminals,Public Company,10102040,Pipeline Transportation of Crude Oil (486110)
