tickerID,IQ_BUS_SEG_PRIMARY_PIC_ABS,IQ_BUS_SEG_SECONDARY_PIC_ABS,IQ_BUS_SEG_PRIMARY_SIC_ABS,IQ_BUS_SEG_SECONDARY_SIC_ABS,IQ_INDUSTRY_SECTOR,IQ_INDUSTRY_GROUP,IQ_INDUSTRY,IQ_PRIMARY_INDUSTRY,IQ_PRIMARY_INDUSTRY_SUBSECTOR5_ID,IQ_PRIMARY_INDUSTRY_SUBSECTOR5_NAME,IQ_PRIMARY_INDUSTRY_SUBSECTOR6_ID,IQ_PRIMARY_SIC_CODE,IQ_PRIMARY_SIC_INDUSTRY,IQ_COMPANY_TYPE,IQ_PICS_CODE,IQ_BUS_SEG_NAIC_ABS
NYSE:SUM,Construction Materials ,Construction Materials ,Sand and gravel (1440),"Concrete, gypsum, and plaster products (3270)",Materials,Materials,Construction Materials,Construction Materials,2031500,Concrete,(Invalid Subsector ID),1400,"Mining and quarrying of nonmetallic minerals, except fuels",Public Company,15102010,Cement and Concrete Product Manufacturing (3273)
NasdaqGS:PZZA,Restaurants ,0,Eating places (5812),0,Consumer Discretionary,Consumer Services,"Hotels, Restaurants and Leisure",Restaurants,4214100,Full Service Restaurants,(Invalid Subsector ID),5812,Eating places,Public Company,25301040,Limited-Service Restaurants (722513)
NYSE:GEF,Forest Products ,Real Estate Development ,Timber tracts (811),Land subdividers and developers (6550),Materials,Materials,Containers and Packaging,Metal and Glass Containers,2041010,Metal Packaging,(Invalid Subsector ID),2650,Paperboard containers and boxes,Public Company,15103010,Forestry and Logging (113)
NYSE:DAN,Auto Parts & Equipment ,Auto Parts & Equipment ,Rubber and plastics hose and belting (3052),Motor vehicle parts and accessories (3714),Consumer Discretionary,Automobiles and Components,Auto Components,Auto Parts and Equipment,4012300,"Gaskets, Hoses and Belts",(Invalid Subsector ID),3714,Motor vehicle parts and accessories,Public Company,25101010,Rubber and Plastics Hoses and Belting Manufacturing (326220)
NYSE:ORA,Renewable Electricity ,Renewable Electricity ,Electric services (4910),Electric services (4911),Utilities,Utilities,Independent Power and Renewable Electricity Producers,Renewable Electricity,0,0,(Invalid Subsector ID),4911,Electric services,Public Company,55105020,Geothermal Electric Power Generation (221116)
NasdaqGS:RP,Application Software ,IT Consulting & Other Services ,Prepackaged software (7372),Computer related services (7379),Information Technology,Software and Services,Software,Application Software,8041350,Enterprise Software,(Invalid Subsector ID),7372,Prepackaged software,Public Company,45103010,Software Publishers (511210)
NYSE:BDC,0,0,0,0,Information Technology,Technology Hardware and Equipment,"Electronic Equipment, Instruments and Components",Electronic Components,0,0,(Invalid Subsector ID),3357,Nonferrous wiredrawing and insulating,Public Company,45203015,0
NYSE:TSE,Commodity Chemicals ,0,"Plastic material, synthetic resins, synthetic rubber, cellulose, and other manmade fibers, except glass (2820)",0,Materials,Materials,Chemicals,Commodity Chemicals,2021200,Industrial Organic Chemicals,(Invalid Subsector ID),2821,Plastics materials and resins,Public Company,15101010,"Resin, Synthetic Rubber, and Artificial Synthetic Fibers and Filaments Manufacturing (3252)"
NYSE:BYD,Casinos & Gaming ,Casinos & Gaming ,Amusement and recreation (7999),Amusement and recreation (7999),Consumer Discretionary,Consumer Services,"Hotels, Restaurants and Leisure",Casinos and Gaming,4211100,Casinos,(Invalid Subsector ID),7990,Miscellaneous amusement and recreation services,Public Company,25301010,Casinos (except Casino Hotels) (713210)
NasdaqGS:IDCC,Communications Equipment ,"Technology Hardware, Storage and Peripherals ",Telephone and telegraph apparatus (3661),Radio and Television communications equipment (3663),Information Technology,Technology Hardware and Equipment,Communications Equipment,Communications Equipment,0,0,(Invalid Subsector ID),6794,Patent owners and lessors,Public Company,45201020,Telephone Apparatus Manufacturing (334210)
NasdaqGS:ICPT,Biotechnology ,Pharmaceuticals ,Biological products except diagnostic (2836),Drugs (2830),Healthcare,"Pharmaceuticals, Biotechnology and Life Sciences",Biotechnology,Biotechnology,0,0,(Invalid Subsector ID),2836,Biological products except diagnostic,Public Company,35201010,Biological Product (except Diagnostic) Manufacturing (325414)
NYSE:PBI,Office Services & Supplies ,Application Software ,Office machines (3579),Prepackaged software (7372),Industrials,Commercial and Professional Services,Commercial Services and Supplies,Office Services and Supplies,0,0,(Invalid Subsector ID),3579,Office machines,Public Company,20201060,Other Commercial and Service Industry Machinery Manufacturing (333318)
NasdaqGS:DORM,Auto Parts & Equipment ,0,Motor vehicle parts and accessories (3714),0,Consumer Discretionary,Automobiles and Components,Auto Components,Auto Parts and Equipment,4012850,Automotive Maintenance Equipment,(Invalid Subsector ID),3714,Motor vehicle parts and accessories,Public Company,25101010,Other Motor Vehicle Parts Manufacturing (336390)
NYSE:NYT,Publishing ,Publishing ,"Printing, publishing, and allied industries (2700)",Miscellaneous publishing (2741),Consumer Discretionary,Media,Media,Publishing,4314100,Printed Media Publishing,(Invalid Subsector ID),2711,Newspapers,Public Company,25401040,"Newspaper, Periodical, Book, and Directory Publishers (5111)"
NYSE:JAG,Oil & Gas Exploration & Production ,0,Crude petroleum and natural gas (1311),0,Energy,Energy,"Oil, Gas and Consumable Fuels",Oil and Gas Exploration and Production,1032200,Oil and Gas Production,(Invalid Subsector ID),1311,Crude petroleum and natural gas,Public Company,10102020,Crude Petroleum and Natural Gas Extraction (211111)
NYSE:UNF,0,0,0,0,Industrials,Commercial and Professional Services,Commercial Services and Supplies,Diversified Support Services,9551754,Commercial Rental and Leasing Services,(Invalid Subsector ID),2300,Apparel and other finished products made from fabrics and similar materials,Public Company,20201070,0
NYSE:OAS,Oil & Gas Exploration & Production ,0,Crude petroleum and natural gas (1311),0,Energy,Energy,"Oil, Gas and Consumable Fuels",Oil and Gas Exploration and Production,1032200,Oil and Gas Production,(Invalid Subsector ID),1311,Crude petroleum and natural gas,Public Company,10102020,Oil and Gas Extraction (21111)
NasdaqGS:PLAY,Restaurants ,Casinos & Gaming ,Eating places (5812),Miscellaneous amusement and recreation services (7990),Consumer Discretionary,Consumer Services,"Hotels, Restaurants and Leisure",Restaurants,0,0,(Invalid Subsector ID),5810,Eating and drinking places,Public Company,25301040,Restaurants and Other Eating Places (72251)
TSX:AYA,Casinos & Gaming ,Home Entertainment Software ,Miscellaneous amusement and recreation services (7990),Prepackaged software (7372),Consumer Discretionary,Consumer Services,"Hotels, Restaurants and Leisure",Casinos and Gaming,4211100,Casinos,(Invalid Subsector ID),7990,Miscellaneous amusement and recreation services,Public Company,25301010,Other Gambling Industries (713290)
NYSE:ESL,Commodity Chemicals ,Electronic Equipment & Instruments ,"Plastic material, synthetic resins, synthetic rubber, cellulose, and other manmade fibers, except glass (2820)","Measuring, analyzing, and control instruments; photographic, medical, and optical goods; and watches and clocks (3800)",Industrials,Capital Goods,Aerospace and Defense,Aerospace and Defense,3021100,"Aircraft Systems, Components and Equipment",(Invalid Subsector ID),3812,Search and navigation equipment,Public Company,20101010,"Resin, Synthetic Rubber, and Artificial Synthetic Fibers and Filaments Manufacturing (3252)"
NYSE:SJI,Gas Utilities ,Oil & Gas Exploration & Production ,Natural gas distribution (4924),Crude petroleum and natural gas (1311),Utilities,Utilities,Gas Utilities,Gas Utilities,1033200,Oil and Gas Distribution,(Invalid Subsector ID),4924,Natural gas distribution,Public Company,55102010,Natural Gas Distribution (221210)
NasdaqGS:SANM,Electronic Manufacturing Services ,0,Electronic components and accessories (3670),0,Information Technology,Technology Hardware and Equipment,"Electronic Equipment, Instruments and Components",Electronic Manufacturing Services,8132200,Outsourced Technology Manufacturing Services,(Invalid Subsector ID),3672,Printed circuit boards,Public Company,45203020,Semiconductor and Other Electronic Component Manufacturing (33441)
NYSE:PEN,Health Care Equipment ,Health Care Supplies ,Surgical and medical instruments (3841),Surgical appliances and supplies (3842),Healthcare,Healthcare Equipment and Services,Healthcare Equipment and Supplies,Healthcare Equipment,6021100,Medical Equipment,(Invalid Subsector ID),3841,Surgical and medical instruments,Public Company,35101010,Surgical and Medical Instrument Manufacturing (339112)
NYSE:WBT,Industrial Machinery ,Industrial Machinery ,Food products machinery (3556),Refrigeration and heating equipment (3585),Industrials,Capital Goods,Machinery,Industrial Machinery,3072500,Food and Beverage Machinery,(Invalid Subsector ID),3580,Refrigeration and service industry machinery,Public Company,20106020,Food Product Machinery Manufacturing (333241)
NYSE:CBU,Regional Banks ,Asset Management & Custody Banks ,Commercial banks (6020),Investment offices (6720),Financials,Banks,Banks,Regional Banks,7012200,National and State Commercial Banks,(Invalid Subsector ID),6020,Commercial banks,Public Company,40101015,Commercial Banking (522110)
NYSE:ASGN,IT Consulting & Other Services ,Research & Consulting Services ,Computer related services (7379),Management and public relations services (8740),Industrials,Commercial and Professional Services,Professional Services,Human Resource and Employment Services,3113300,Executive Placing Services,(Invalid Subsector ID),7363,Help supply services,Public Company,20202010,Computer Systems Design and Related Services (5415)
NYSE:VGR,Tobacco ,0,Cigarettes (2111),0,Consumer Staples,"Food, Beverage and Tobacco",Tobacco,Tobacco,5131100,Cigarettes,(Invalid Subsector ID),6531,Real estate agents and managers,Public Company,30203010,Tobacco Manufacturing (312230)
NYSE:BKFS,Application Software ,Internet Software & Services ,Prepackaged software (7372),Information retrieval services (7375),Information Technology,Software and Services,IT Services,Data Processing and Outsourced Services,8032100,Infrastructure Services,(Invalid Subsector ID),7374,Data processing and preparation,Public Company,45102020,Software Publishers (511210)
NasdaqGS:FEYE,Systems Software ,Internet Software & Services ,Prepackaged software (7372),Information retrieval services (7375),Information Technology,Software and Services,Software,Systems Software,8042150,Security Software,(Invalid Subsector ID),7373,Computer integrated systems design,Public Company,45103020,Software Publishers (511210)
NYSE:AVA,0,0,0,0,Utilities,Utilities,Multi-Utilities,Multi-Utilities,0,0,(Invalid Subsector ID),4931,Electric and other services combined,Public Company,55103010,0
NasdaqGS:NXST,0,0,0,0,Consumer Discretionary,Media,Media,Broadcasting,4312101,Television,(Invalid Subsector ID),4833,Television broadcasting stations,Public Company,25401020,0
NasdaqGS:CHDN,Casinos & Gaming ,0,Miscellaneous amusement and recreation services (7990),0,Consumer Discretionary,Consumer Services,"Hotels, Restaurants and Leisure",Casinos and Gaming,4211100,Casinos,(Invalid Subsector ID),7990,Miscellaneous amusement and recreation services,Public Company,25301010,Other Gambling Industries (713290)
NasdaqGS:PSMT,0,0,0,0,Consumer Staples,Food and Staples Retailing,Food and Staples Retailing,Hypermarkets and Super Centers,5024100,Warehouse Clubs,(Invalid Subsector ID),5331,Variety stores,Public Company,30101040,0
NasdaqGS:ACIW,0,0,0,0,Information Technology,Software and Services,Software,Application Software,8041350,Enterprise Software,(Invalid Subsector ID),7370,"Computer programming, data processing, and other computer related services",Public Company,45103010,0
NasdaqGS:CAKE,Packaged Foods & Meats ,0,Bakery products (2050),0,Consumer Discretionary,Consumer Services,"Hotels, Restaurants and Leisure",Restaurants,0,0,(Invalid Subsector ID),5812,Eating places,Public Company,25301040,Bread and Bakery Product Manufacturing (31181)
NYSE:XON,Biotechnology ,0,Biological products except diagnostic (2836),0,Healthcare,"Pharmaceuticals, Biotechnology and Life Sciences",Biotechnology,Biotechnology,9551742,Agricultural Biotechnology,(Invalid Subsector ID),2836,Biological products except diagnostic,Public Company,35201010,Biological Product (except Diagnostic) Manufacturing (325414)
NYSE:WOR,Steel ,0,"Steel works, blast furnaces, and rolling and finishing mills (3310)",0,Materials,Materials,Metals and Mining,Steel,2055006,"Steel Works, Blast Furnaces, And Finishing Mills",(Invalid Subsector ID),3310,"Steel works, blast furnaces, and rolling and finishing mills",Public Company,15104050,Iron and Steel Mills and Ferroalloy Manufacturing (33111)
NYSE:BGS,Packaged Foods & Meats ,Packaged Foods & Meats ,"Canned, frozen, and preserved fruits, vegetables, and food specialties (2030)",Grain mill products (2040),Consumer Staples,"Food, Beverage and Tobacco",Food Products,Packaged Foods and Meats,5122700,Bread and Bakery Products,(Invalid Subsector ID),2033,Canned fruits and vegetables,Public Company,30202030,Frozen Food Manufacturing (31141)
NYSE:JBT,Industrial Machinery ,0,Food products machinery (3556),0,Industrials,Capital Goods,Machinery,Industrial Machinery,3072500,Food and Beverage Machinery,(Invalid Subsector ID),3550,"Special industry machinery, except metalworking machinery",Public Company,20106020,Food Product Machinery Manufacturing (333241)
NYSE:BXS,Regional Banks ,Specialized Finance ,Commercial banks (6020),Business credit institutions (6150),Financials,Banks,Banks,Regional Banks,0,0,(Invalid Subsector ID),6020,Commercial banks,Public Company,40101015,Commercial Banking (522110)
NYSE:CLDR,Internet Software & Services ,0,Information retrieval services (7375),0,Information Technology,Software and Services,Internet Software and Services,Internet Software and Services,8021200,Online Services,(Invalid Subsector ID),7370,"Computer programming, data processing, and other computer related services",Public Company,45101010,"Data Processing, Hosting, and Related Services (518)"
NYSE:QEP,Oil & Gas Refining & Marketing ,0,Petroleum refining (2911),0,Energy,Energy,"Oil, Gas and Consumable Fuels",Oil and Gas Exploration and Production,1032200,Oil and Gas Production,(Invalid Subsector ID),1311,Crude petroleum and natural gas,Public Company,10102020,Petroleum Refineries (324110)
NasdaqGS:HQY,Managed Health Care ,Health Care Technology ,Offices of health practitioners (8049),Prepackaged software (7372),Healthcare,Healthcare Equipment and Services,Healthcare Providers and Services,Managed Healthcare,0,0,(Invalid Subsector ID),7370,"Computer programming, data processing, and other computer related services",Public Company,35102030,Offices of All Other Miscellaneous Health Practitioners (621399)
NasdaqGS:HA,Airlines ,Air Freight & Logistics ,"Air transportation, scheduled (4512)","Air transportation, nonscheduled (4522)",Industrials,Transportation,Airlines,Airlines,3221100,Commercial Airlines,(Invalid Subsector ID),4512,"Air transportation, scheduled",Public Company,20302010,Scheduled Passenger Air Transportation (481111)
NasdaqGS:IRWD,Pharmaceuticals ,0,Drugs (2830),0,Healthcare,"Pharmaceuticals, Biotechnology and Life Sciences",Biotechnology,Biotechnology,0,0,(Invalid Subsector ID),2834,Pharmaceutical preparations,Public Company,35201010,Pharmaceutical and Medicine Manufacturing (32541)
NYSE:TCF,Regional Banks ,0,Commercial banks (6020),0,Financials,Banks,Banks,Regional Banks,7012200,National and State Commercial Banks,(Invalid Subsector ID),6020,Commercial banks,Public Company,40101015,Commercial Banking (522110)
NYSE:FDP,0,0,0,0,Consumer Staples,"Food, Beverage and Tobacco",Food Products,Agricultural Products,5121100,"Fruits, Vegetables, and Nuts",(Invalid Subsector ID),100,Agricultural production-crops,Public Company,30202010,0
NYSE:BID,Consumer Finance ,Consumer Finance ,Personal credit institutions (6141),Personal credit institutions (6141),Consumer Discretionary,Consumer Services,Diversified Consumer Services,Specialized Consumer Services,9551723,Consumer Auction Services,(Invalid Subsector ID),7389,Business services,Public Company,25302020,Nondepository Credit Intermediation (5222)
NasdaqGS:AMKR,Electronic Manufacturing Services ,0,Electronic components and accessories (3670),0,Information Technology,Semiconductors and Semiconductor Equipment,Semiconductors and Semiconductor Equipment,Semiconductor Equipment,8211100,Semiconductor Manufacturing Machinery,(Invalid Subsector ID),3674,Semiconductors and related devices,Public Company,45301010,Semiconductor and Other Electronic Component Manufacturing (33441)
NYSE:PBH,Pharmaceuticals ,0,Pharmaceutical preparations (2834),0,Healthcare,"Pharmaceuticals, Biotechnology and Life Sciences",Pharmaceuticals,Pharmaceuticals,6121100,Pharmaceutical Products,(Invalid Subsector ID),5122,"Drugs, proprietaries, and sundries",Public Company,35202010,Pharmaceutical Preparation Manufacturing (325412)
TSX:YRI,Gold ,Copper ,Gold ores (1041),Copper ores (1021),Materials,Materials,Metals and Mining,Gold,2053010,Gold Ores,(Invalid Subsector ID),1040,Gold and silver ores,Public Company,15104030,Gold Ore Mining (212221)
NasdaqGS:SAFM,Packaged Foods & Meats ,Packaged Foods & Meats ,Meat products (2010),"Canned, frozen, and preserved fruits, vegetables, and food specialties (2030)",Consumer Staples,"Food, Beverage and Tobacco",Food Products,Packaged Foods and Meats,5122850,Frozen Foods,(Invalid Subsector ID),2015,Poultry slaughtering and processing,Public Company,30202030,Animal Slaughtering and Processing (31161)
NYSE:DAR,0,0,0,0,Consumer Staples,"Food, Beverage and Tobacco",Food Products,Agricultural Products,0,0,(Invalid Subsector ID),2070,Fats and oils,Public Company,30202010,0
TSX:PAAS,Silver ,Diversified Metals & Mining ,Silver ores (1044),Metal mining (1000),Materials,Materials,Metals and Mining,Silver,2053020,Silver Ores,(Invalid Subsector ID),1040,Gold and silver ores,Public Company,15104045,Silver Ore Mining (212222)
NYSE:OII,0,0,0,0,Energy,Energy,Energy Equipment and Services,Oil and Gas Equipment and Services,1022200,Oil and Gas Field Services,(Invalid Subsector ID),1389,Oil and gas field services,Public Company,10101020,0
NasdaqGS:IRBT,Aerospace & Defense ,Electronic Equipment & Instruments ,Search and navigation equipment (3812),"Measuring, analyzing, and control instruments; photographic, medical, and optical goods; and watches and clocks (3800)",Consumer Discretionary,Consumer Durables and Apparel,Household Durables,Household Appliances,0,0,(Invalid Subsector ID),3990,Miscellaneous manufacturing industries,Public Company,25201040,"Search, Detection, Navigation, Guidance, Aeronautical, and Nautical System and Instrument Manufacturing (334511)"
NYSE:FCFS,Consumer Finance ,0,Personal credit institutions (6141),0,Financials,Diversified Financials,Consumer Finance,Consumer Finance,7121100,Personal Credit Agencies,(Invalid Subsector ID),5900,Miscellaneous retail,Public Company,40202010,Nondepository Credit Intermediation (5222)
NYSE:WAGE,Human Resource & Employment Services ,0,"Accounting, auditing, and bookkeeping (8721)",0,Industrials,Commercial and Professional Services,Professional Services,Human Resource and Employment Services,0,0,(Invalid Subsector ID),6411,"Insurance agents, brokers, and service",Public Company,20202010,"Accounting, Tax Preparation, Bookkeeping, and Payroll Services (54121)"
NasdaqGS:ODP,Specialty Stores ,Computer & Electronics Retail ,Stationery stores (5943),Computer and software stores (5734),Consumer Discretionary,Retailing,Specialty Retail,Specialty Stores,4444150,Office Furnishings and Equipment Stores,(Invalid Subsector ID),5940,Miscellaneous shopping goods stores,Public Company,25504040,Office Supplies and Stationery Stores (453210)
TSX:STN,Construction & Engineering ,Research & Consulting Services ,Engineering services (8711),Management and public relations services (8740),Industrials,Commercial and Professional Services,Professional Services,Research and Consulting Services,3115600,Consulting Services,(Invalid Subsector ID),8711,Engineering services,Public Company,20202020,Engineering Services (541330)
NYSE:BKD,Health Care Facilities ,0,Nursing and personal care (8059),0,Healthcare,Healthcare Equipment and Services,Healthcare Providers and Services,Healthcare Facilities,6033200,Assisted Living Facilities and Services,(Invalid Subsector ID),8051,Skilled nursing care facilities,Public Company,35102020,Continuing Care Retirement Communities (623311)
NYSE:KNX,Trucking ,0,"Trucking and courier services, except air (4210)",0,Industrials,Transportation,Road and Rail,Trucking,3242100,Road Transportation of Freight,(Invalid Subsector ID),4213,"Trucking, except local",Public Company,20304020,Truck Transportation (484)
NYSE:NAV,Auto Parts & Equipment ,0,Motor vehicle parts and accessories (3714),0,Industrials,Capital Goods,Machinery,Construction Machinery and Heavy Trucks,4021140,Buses,(Invalid Subsector ID),3711,Motor vehicles and car bodies,Public Company,20106010,Motor Vehicle Gasoline Engine and Engine Parts Manufacturing (33631)
NYSE:RNG,Application Software ,Communications Equipment ,Prepackaged software (7372),Telephone and telegraph apparatus (3661),Information Technology,Software and Services,Software,Application Software,0,0,(Invalid Subsector ID),7372,Prepackaged software,Public Company,45103010,Software Publishers (511210)
NYSE:INT,Oil & Gas Refining & Marketing ,Oil & Gas Storage & Transportation ,Petroleum products (5172),Fuel dealers (5980),Energy,Energy,"Oil, Gas and Consumable Fuels",Oil and Gas Refining and Marketing,0,0,(Invalid Subsector ID),5172,Petroleum products,Public Company,10102030,Petroleum and Petroleum Products Merchant Wholesalers (except Bulk Stations and Terminals) (424720)
NasdaqGS:VIAV,Communications Equipment ,0,Telephone and telegraph apparatus (3661),0,Information Technology,Technology Hardware and Equipment,Communications Equipment,Communications Equipment,8111200,Networking Equipment,(Invalid Subsector ID),3576,Computer communications equipment,Public Company,45201020,Telephone Apparatus Manufacturing (334210)
NYSE:RMP,Oil & Gas Storage & Transportation ,0,Natural gas transmission (4922),0,Energy,Energy,"Oil, Gas and Consumable Fuels",Oil and Gas Storage and Transportation,1033307,Natural Gas Pipelines,(Invalid Subsector ID),1311,Crude petroleum and natural gas,Public Company,10102040,Pipeline Transportation of Natural Gas (486210)
NYSE:MTX,Commodity Chemicals ,Construction Materials ,Industrial inorganic chemicals (2810),Dimension stone (1411),Materials,Materials,Chemicals,Specialty Chemicals,0,0,(Invalid Subsector ID),2810,Industrial inorganic chemicals,Public Company,15101050,Other Basic Inorganic Chemical Manufacturing (32518)
NasdaqGS:ITRI,Electronic Equipment & Instruments ,Application Software ,"Measuring, analyzing, and control instruments; photographic, medical, and optical goods; and watches and clocks (3800)",Prepackaged software (7372),Information Technology,Technology Hardware and Equipment,"Electronic Equipment, Instruments and Components",Electronic Equipment and Instruments,8131200,"Measuring, Analyzing, and Controlling Instruments",(Invalid Subsector ID),3824,Fluid meters and counting devices,Public Company,45203010,Electromedical and Electrotherapeutic Apparatus Manufacturing (334510)
NYSE:FUL,Specialty Chemicals ,0,Adhesives and sealants (2891),0,Materials,Materials,Chemicals,Specialty Chemicals,2024300,Adhesives And Sealants,(Invalid Subsector ID),2891,Adhesives and sealants,Public Company,15101050,Adhesive Manufacturing (325520)
NYSE:MUSA,Automotive Retail ,0,Gasoline service stations (5541),0,Consumer Discretionary,Retailing,Specialty Retail,Automotive Retail,4444850,Oil and Gas Retail,(Invalid Subsector ID),5500,Automotive dealers and gasoline service stations,Public Company,25504050,Other Gasoline Stations (447190)
NYSE:AXE,Technology Distributors ,Trading Companies & Distributors ,Electronic parts and equipment (5065),Electrical apparatus and equipment (5063),Information Technology,Technology Hardware and Equipment,"Electronic Equipment, Instruments and Components",Technology Distributors,8133400,Communications Equipment Distribution,(Invalid Subsector ID),5065,Electronic parts and equipment,Public Company,45203030,Other Electronic Parts and Equipment Merchant Wholesalers (423690)
NasdaqGS:FFIN,Regional Banks ,0,Commercial banks (6020),0,Financials,Banks,Banks,Regional Banks,7012200,National and State Commercial Banks,(Invalid Subsector ID),6020,Commercial banks,Public Company,40101015,Commercial Banking (522110)
NasdaqGS:JUNO,Biotechnology ,0,Drugs (2830),0,Healthcare,"Pharmaceuticals, Biotechnology and Life Sciences",Biotechnology,Biotechnology,0,0,(Invalid Subsector ID),2836,Biological products except diagnostic,Public Company,35201010,Pharmaceutical and Medicine Manufacturing (32541)
NYSE:DDD,"Technology Hardware, Storage and Peripherals ",0,Calculating and accounting equipment (3578),0,Information Technology,Technology Hardware and Equipment,"Technology Hardware, Storage and Peripherals","Technology Hardware, Storage and Peripherals",8121400,Industry Specific Electronics,(Invalid Subsector ID),3559,Special industry machinery,Public Company,45202030,Computer Terminal and Other Computer Peripheral Equipment Manufacturing (334118)
NasdaqGS:VRNT,Systems Software ,0,Prepackaged software (7372),0,Information Technology,Software and Services,Software,Application Software,0,0,(Invalid Subsector ID),7373,Computer integrated systems design,Public Company,45103010,Software Publishers (511210)
